{"id":"ex-u01c-ending","schema_version":"1.0.0","content_version":"0.1.0","title":"語尾の違いを観察する固定形","created_at":"2026-08-25T12:00:00+09:00","updated_at":"2026-08-25T12:00:00+09:00","latin":{"canonical_form":"dominus / dominum","display_form":"domin-us / domin-um"},"vocabulary":["lex-dominus"],"tokens":[{"index":0,"kind":"word","surface":"dominus","lemma_id":"lex-dominus","selected_analysis":{"morphology":{"ending":"-us","status":"preview-only"},"syntactic_function":"未分析の固定形"},"alternative_analyses":[],"trailing_punctuation":"/"},{"index":1,"kind":"word","surface":"dominum","lemma_id":"lex-dominus","selected_analysis":{"morphology":{"ending":"-um","status":"preview-only"},"syntactic_function":"未分析の固定形"},"alternative_analyses":[],"trailing_punctuation":""}],"skills":[{"skill_id":"morph.ending.grammatical-information","treatment":"introduce"}],"required_reading_skills":["orth.alphabet.classical-basic"],"unanalyzed_elements":[{"token_indexes":[0,1],"reason":"preview","support":"格名・曲用型・生成は第2・第3単元まで問わない。"}],"treatment":"introduce","translations":{"word_annotations":["同じ見出し語の固定比較形","同じ見出し語の固定比較形"],"structure_aligned":"語尾が異なる二つの形","natural":"同じ語の異なる形"},"origin":{"kind":"generated","generated_statement":true,"work":null},"period":"classical","register":"classical-prose","source_refs":[],"evidence":[{"kind":"project-decision","claim_scope":"語尾の情報性の予告","note":"M2技能仕様に従い、個別の格判定・語形生成を要求しない。","decision_id":"DEC-0014"}],"review":{"draft_status":"ready-for-review","source_checked":[],"editorial_approved":[],"expert_reviewed":[],"automated_validation":[]},"notes":"教材制作例。古典作品からの引用ではない。"}
