{"id":"ex-fixture-est","schema_version":"1.0.0","content_version":"0.1.0","title":"fixture example","created_at":"2026-08-24T00:00:00+09:00","updated_at":"2026-08-24T00:00:00+09:00","latin":{"canonical_form":"est","display_form":"est."},"vocabulary":["lex-fixture-est"],"tokens":[{"index":0,"kind":"word","surface":"est","lemma_id":"lex-fixture-est","selected_analysis":{"morphology":{"person":3,"number":"singular"},"syntactic_function":"finite-verb"},"alternative_analyses":[],"trailing_punctuation":""},{"index":1,"kind":"punctuation","surface":".","trailing_punctuation":""}],"skills":[{"skill_id":"reading.finite-verb.identify","treatment":"guided-practice"}],"required_reading_skills":["reading.finite-verb.identify"],"unanalyzed_elements":[],"treatment":"guided-practice","translations":{"structure_aligned":"〜である。","natural":"〜です。","acceptable_alternatives":[]},"origin":{"kind":"generated","generated_statement":true,"work":null},"period":"classical","register":"classical-prose","source_refs":[],"evidence":[{"kind":"generated-rationale","claim_scope":"fixture structure","note":"古典作品からの引用ではない。"}],"review":{"draft_status":"draft","source_checked":[],"editorial_approved":[],"expert_reviewed":[],"automated_validation":[]},"notes":"fixture only"}
