{"id":"ex-u01b-roma","schema_version":"1.0.0","content_version":"0.1.0","title":"長母音を含む音節","created_at":"2026-08-25T12:00:00+09:00","updated_at":"2026-08-25T12:00:00+09:00","latin":{"canonical_form":"Rōma","display_form":"Rō-ma"},"vocabulary":["lex-roma"],"tokens":[{"index":0,"kind":"word","surface":"Rōma","lemma_id":"lex-roma","selected_analysis":{"morphology":{"syllables":["Rō","ma"],"first_syllable_quantity":"long-by-nature"},"syntactic_function":"単独の表示語"},"alternative_analyses":[],"trailing_punctuation":""}],"skills":[{"skill_id":"orth.macron.recognize","treatment":"guided-practice"},{"skill_id":"phon.syllable.divide-basic","treatment":"guided-practice"},{"skill_id":"phon.syllable.quantity.basic","treatment":"guided-practice"}],"required_reading_skills":["phon.letter-sound.classical-basic"],"unanalyzed_elements":[],"treatment":"guided-practice","translations":{"word_annotations":["都市名ローマ"],"structure_aligned":"ローマ","natural":"ローマ"},"origin":{"kind":"generated","generated_statement":true,"work":null},"period":"classical","register":"classical-prose","source_refs":[{"bibliography_id":"src-lat-ag-dcc","locator":{"section":"§§9–11 Quantity of Syllables","url_fragment":"#quantity-syllables"},"claim_scope":"長母音を含む音節の量","quotation_used":false,"verification_status":"relevant-section-verified","verification_note":"一般規則をDCCで確認し、表示例を制作。","use_mode":"independent-design"}],"evidence":[{"kind":"generated-rationale","claim_scope":"例の選択","note":"長母音と音節区切りを一語で示す制作例。"}],"review":{"draft_status":"ready-for-review","source_checked":[],"editorial_approved":[],"expert_reviewed":[],"automated_validation":[]},"notes":"引用ではない。"}
