{"id":"ex-u01a-caesar","schema_version":"1.0.0","content_version":"0.1.0","title":"cの基本音価","created_at":"2026-08-25T12:00:00+09:00","updated_at":"2026-08-25T12:00:00+09:00","latin":{"canonical_form":"Caesar","display_form":"Caesar"},"vocabulary":["lex-caesar"],"tokens":[{"index":0,"kind":"word","surface":"Caesar","lemma_id":"lex-caesar","selected_analysis":{"morphology":{"status":"not-taught"},"syntactic_function":"単独の表示語","note":"1Aでは形態論を扱わない。"},"alternative_analyses":[],"trailing_punctuation":""}],"skills":[{"skill_id":"phon.letter-sound.classical-basic","treatment":"guided-practice"},{"skill_id":"orth.alphabet.classical-basic","treatment":"review"}],"required_reading_skills":["orth.alphabet.classical-basic"],"unanalyzed_elements":[],"treatment":"guided-practice","translations":{"word_annotations":["人名カエサル"],"structure_aligned":"カエサル","natural":"カエサル"},"origin":{"kind":"generated","generated_statement":true,"work":null},"period":"classical","register":"classical-prose","source_refs":[{"bibliography_id":"src-lat-ag-dcc","locator":{"section":"§8 Vowel and Consonant Pronunciation","url_fragment":"#vowel-and-consonant-pronunciation"},"claim_scope":"cの基本音価","quotation_used":false,"verification_status":"relevant-section-verified","verification_note":"例語を教材用表示例として作成し、音価規則をDCCで確認。","use_mode":"independent-design"}],"evidence":[{"kind":"generated-rationale","claim_scope":"例の選択","note":"cの音価だけを観察する単語例。古典作品からの引用ではない。"}],"review":{"draft_status":"ready-for-review","source_checked":[],"editorial_approved":[],"expert_reviewed":[],"automated_validation":[]},"notes":"発音の人間確認待ち。"}
