{"id":"ex-u01b-terra","schema_version":"1.0.0","content_version":"0.1.0","title":"位置によって長い音節","created_at":"2026-08-25T12:00:00+09:00","updated_at":"2026-08-25T12:00:00+09:00","latin":{"canonical_form":"terra","display_form":"ter-ra"},"vocabulary":["lex-terra"],"tokens":[{"index":0,"kind":"word","surface":"terra","lemma_id":"lex-terra","selected_analysis":{"morphology":{"syllables":["ter","ra"],"first_vowel_quantity":"short","first_syllable_quantity":"long-by-position"},"syntactic_function":"単独の表示語"},"alternative_analyses":[],"trailing_punctuation":""}],"skills":[{"skill_id":"phon.syllable.divide-basic","treatment":"independent-practice"},{"skill_id":"phon.syllable.quantity.basic","treatment":"guided-practice"}],"required_reading_skills":["phon.letter-sound.classical-basic"],"unanalyzed_elements":[],"treatment":"guided-practice","translations":{"word_annotations":["土地、大地"],"structure_aligned":"大地","natural":"大地"},"origin":{"kind":"generated","generated_statement":true,"work":null},"period":"classical","register":"classical-prose","source_refs":[{"bibliography_id":"src-lat-ag-dcc","locator":{"section":"§§9–11 Quantity of Syllables","url_fragment":"#quantity-syllables"},"claim_scope":"短母音と位置による音節量の区別","quotation_used":false,"verification_status":"relevant-section-verified","verification_note":"一般規則をDCCで確認し、表示例を制作。","use_mode":"independent-design"}],"evidence":[{"kind":"generated-rationale","claim_scope":"例の選択","note":"母音長と音節量を混同しないための制作例。"}],"review":{"draft_status":"ready-for-review","source_checked":[],"editorial_approved":[],"expert_reviewed":[],"automated_validation":[]},"notes":"引用ではない。"}
