{"id":"ex-u01a-variants","schema_version":"1.0.0","content_version":"0.1.0","title":"i/jとu/vの表記差","created_at":"2026-08-25T12:00:00+09:00","updated_at":"2026-08-25T12:00:00+09:00","latin":{"canonical_form":"iūs, vir","display_form":"iūs, vir"},"vocabulary":["lex-ius","lex-vir"],"tokens":[{"index":0,"kind":"word","surface":"iūs","lemma_id":"lex-ius","selected_analysis":{"morphology":{"status":"not-taught"},"syntactic_function":"単独の表示語"},"alternative_analyses":[],"trailing_punctuation":","},{"index":1,"kind":"word","surface":"vir","lemma_id":"lex-vir","selected_analysis":{"morphology":{"status":"not-taught"},"syntactic_function":"単独の表示語"},"alternative_analyses":[],"trailing_punctuation":""}],"skills":[{"skill_id":"orth.i-j.variant-recognize","treatment":"guided-practice"},{"skill_id":"orth.u-v.variant-recognize","treatment":"guided-practice"}],"required_reading_skills":["orth.alphabet.classical-basic"],"unanalyzed_elements":[],"treatment":"guided-practice","translations":{"word_annotations":["法・権利","男・男性"],"structure_aligned":"法、男","natural":"「法」と「男」という二つの表示語"},"origin":{"kind":"generated","generated_statement":true,"work":null},"period":"classical","register":"classical-prose","source_refs":[{"bibliography_id":"src-lat-ag-dcc","locator":{"section":"§1 Alphabet","url_fragment":"#alphabet"},"claim_scope":"IとVの母音・子音用法と版の表記","quotation_used":false,"verification_status":"relevant-section-verified","verification_note":"表記差の規則をDCCで確認。","use_mode":"independent-design"}],"evidence":[{"kind":"generated-rationale","claim_scope":"例の選択","note":"正書法の対応だけを観察する制作例。引用ではない。"}],"review":{"draft_status":"ready-for-review","source_checked":[],"editorial_approved":[],"expert_reviewed":[],"automated_validation":[]},"notes":"長母音は1Bまで採点しない。"}
