{"id":"ex-u01c-amicus","schema_version":"1.0.0","content_version":"0.1.0","title":"長いペヌルティマとアクセント","created_at":"2026-08-25T12:00:00+09:00","updated_at":"2026-08-25T12:00:00+09:00","latin":{"canonical_form":"amīcus","display_form":"a-mī-cus"},"vocabulary":["lex-amicus"],"tokens":[{"index":0,"kind":"word","surface":"amīcus","lemma_id":"lex-amicus","selected_analysis":{"morphology":{"syllables":["a","mī","cus"],"accented_syllable":"mī"},"syntactic_function":"単独の表示語"},"alternative_analyses":[],"trailing_punctuation":""}],"skills":[{"skill_id":"phon.accent.rule.basic","treatment":"guided-practice"},{"skill_id":"phon.syllable.quantity.basic","treatment":"review"}],"required_reading_skills":["phon.syllable.divide-basic","phon.syllable.quantity.basic"],"unanalyzed_elements":[],"treatment":"guided-practice","translations":{"word_annotations":["友人"],"structure_aligned":"友人","natural":"友人"},"origin":{"kind":"generated","generated_statement":true,"work":null},"period":"classical","register":"classical-prose","source_refs":[{"bibliography_id":"src-lat-ag-dcc","locator":{"section":"§12 Accents","url_fragment":"#accents"},"claim_scope":"長いペヌルティマを持つ三音節語のアクセント","quotation_used":false,"verification_status":"relevant-section-verified","verification_note":"一般規則をDCCで確認し、表示例を制作。","use_mode":"independent-design"}],"evidence":[{"kind":"generated-rationale","claim_scope":"例の選択","note":"基本アクセント規則を一語で示す制作例。"}],"review":{"draft_status":"ready-for-review","source_checked":[],"editorial_approved":[],"expert_reviewed":[],"automated_validation":[]},"notes":"実際の音声は提供しない。"}
